{
 "id": "vz5cl4b7vg",
 "preferred_name": "Segment (software)",
 "kind": "platform",
 "definition": "A customer data platform, owned by Twilio, that collects event data from websites and apps and sends it to other tools.",
 "key": "segment-software",
 "certification": false,
 "variants": [
  {
   "label": "Twilio Segment",
   "match": "word_ci"
  }
 ],
 "relations": [],
 "verbs": [],
 "status": "machine-drafted",
 "provenance": {
  "source": "drafted by model:claude-sonnet-5-5, run 2026-10-29-round-07-a4, from the name in the legacy tag list alone; no posting or outside source checked",
  "date": "2026-10-29",
  "reviewed_by": null,
  "legacy_tag": {
   "sources": [
    {
     "file": "data/skills_tags.csv",
     "rows": [
      3518
     ],
     "class": "Skill"
    }
   ],
   "class": "Skill",
   "in_lists": []
  }
 },
 "evidence": [
  {
   "field": "definition",
   "by": "model:claude-sonnet-5-5",
   "action": "drafted",
   "date": "2026-10-29",
   "run": "2026-10-29-round-07-a4",
   "note": "basis: general-knowledge"
  },
  {
   "field": "kind",
   "by": "model:claude-sonnet-5-5",
   "action": "drafted",
   "date": "2026-10-29",
   "run": "2026-10-29-round-07-a4",
   "note": "basis: general-knowledge (with the definition)"
  },
  {
   "field": "variant:twilio segment",
   "by": "model:claude-sonnet-5-5",
   "action": "drafted",
   "date": "2026-10-29",
   "run": "2026-10-29-round-07-a4",
   "note": "basis: general-knowledge"
  },
  {
   "field": "certification",
   "by": "model:claude-sonnet-5-5",
   "action": "drafted",
   "date": "2026-10-29",
   "run": "2026-10-29-round-07-a4",
   "note": "basis: general-knowledge"
  },
  {
   "field": "definition",
   "by": "model:claude-opus-5-5",
   "action": "checked",
   "outcome": "supports",
   "date": "2026-10-29",
   "run": "2026-10-29-review-5o-opus",
   "note": "Twilio acquired Segment in 2020."
  },
  {
   "field": "kind",
   "by": "model:claude-opus-5-5",
   "action": "checked",
   "outcome": "supports",
   "date": "2026-10-29",
   "run": "2026-10-29-review-5o-opus"
  },
  {
   "field": "certification",
   "by": "model:claude-opus-5-5",
   "action": "checked",
   "outcome": "supports",
   "date": "2026-10-29",
   "run": "2026-10-29-review-5o-opus"
  },
  {
   "field": "variant:twilio segment",
   "by": "model:claude-opus-5-5",
   "action": "checked",
   "outcome": "supports",
   "date": "2026-10-29",
   "run": "2026-10-29-review-5o-opus"
  }
 ]
}
