{
 "id": "l6wcns768h",
 "preferred_name": "Program evaluation",
 "kind": "skill",
 "definition": "Systematically gathering and analysing evidence to judge how well a programme works and whether it meets its goals.",
 "key": "program-evaluation",
 "certification": false,
 "variants": [
  {
   "label": "Program Evaluations",
   "match": "word_ci"
  }
 ],
 "relations": [
  {
   "type": "related",
   "target": "nna0x6ic9d"
  }
 ],
 "verbs": [],
 "status": "machine-drafted",
 "provenance": {
  "source": "drafted by model:claude-sonnet-5-5, run 2026-10-29-round-07-a2, from the name in the legacy tag list alone; no posting or outside source checked",
  "date": "2026-10-29",
  "reviewed_by": null,
  "legacy_tag": {
   "sources": [
    {
     "file": "data/skills_tags.csv",
     "rows": [
      3170
     ],
     "class": "Skill"
    }
   ],
   "class": "Skill",
   "in_lists": []
  }
 },
 "evidence": [
  {
   "field": "definition",
   "by": "model:claude-sonnet-5-5",
   "action": "drafted",
   "date": "2026-10-29",
   "run": "2026-10-29-round-07-a2",
   "note": "basis: general-knowledge"
  },
  {
   "field": "kind",
   "by": "model:claude-sonnet-5-5",
   "action": "drafted",
   "date": "2026-10-29",
   "run": "2026-10-29-round-07-a2",
   "note": "basis: general-knowledge (with the definition)"
  },
  {
   "field": "variant:program evaluations",
   "by": "model:claude-sonnet-5-5",
   "action": "drafted",
   "date": "2026-10-29",
   "run": "2026-10-29-round-07-a2",
   "note": "listed in the legacy tag list; the model chose the canonical name"
  },
  {
   "field": "relation:related:nna0x6ic9d",
   "by": "model:claude-sonnet-5-5",
   "action": "drafted",
   "date": "2026-10-29",
   "run": "2026-10-29-round-07-a2",
   "note": "basis: general-knowledge"
  },
  {
   "field": "certification",
   "by": "model:claude-sonnet-5-5",
   "action": "drafted",
   "date": "2026-10-29",
   "run": "2026-10-29-round-07-a2",
   "note": "basis: general-knowledge"
  },
  {
   "field": "definition",
   "by": "model:claude-opus-5-5",
   "action": "checked",
   "outcome": "supports",
   "date": "2026-10-29",
   "run": "2026-10-29-review-5m-opus"
  },
  {
   "field": "kind",
   "by": "model:claude-opus-5-5",
   "action": "checked",
   "outcome": "supports",
   "date": "2026-10-29",
   "run": "2026-10-29-review-5m-opus"
  },
  {
   "field": "certification",
   "by": "model:claude-opus-5-5",
   "action": "checked",
   "outcome": "supports",
   "date": "2026-10-29",
   "run": "2026-10-29-review-5m-opus"
  },
  {
   "field": "variant:program evaluations",
   "by": "model:claude-opus-5-5",
   "action": "checked",
   "outcome": "supports",
   "date": "2026-10-29",
   "run": "2026-10-29-review-5m-opus"
  },
  {
   "field": "relation:related:nna0x6ic9d",
   "by": "model:claude-opus-5-5",
   "action": "checked",
   "outcome": "supports",
   "date": "2026-10-29",
   "run": "2026-10-29-review-5m-opus"
  },
  {
   "field": "definition",
   "by": "model:gpt-6",
   "action": "checked",
   "outcome": "supports",
   "date": "2026-10-29",
   "run": "external-2026-10-29-gpt-6-unknown"
  },
  {
   "field": "kind",
   "by": "model:gpt-6",
   "action": "checked",
   "outcome": "supports",
   "date": "2026-10-29",
   "run": "external-2026-10-29-gpt-6-unknown"
  },
  {
   "field": "certification",
   "by": "model:gpt-6",
   "action": "checked",
   "outcome": "supports",
   "date": "2026-10-29",
   "run": "external-2026-10-29-gpt-6-unknown"
  },
  {
   "field": "variant:program evaluations",
   "by": "model:gpt-6",
   "action": "checked",
   "outcome": "supports",
   "date": "2026-10-29",
   "run": "external-2026-10-29-gpt-6-unknown"
  },
  {
   "field": "relation:related:nna0x6ic9d",
   "by": "model:gpt-6",
   "action": "checked",
   "outcome": "supports",
   "date": "2026-10-29",
   "run": "external-2026-10-29-gpt-6-unknown"
  }
 ]
}
