{
 "id": "zgnj6ebugu",
 "preferred_name": "Cucumber.js",
 "kind": "tool",
 "definition": "The JavaScript implementation of Cucumber, which runs plain-language Gherkin specifications as automated tests.",
 "key": "cucumber-js",
 "certification": false,
 "variants": [
  {
   "label": "Cucumberjs",
   "match": "word_ci"
  }
 ],
 "relations": [],
 "verbs": [],
 "status": "machine-drafted",
 "provenance": {
  "source": "drafted by model:claude-sonnet-5-5, run 2026-10-29-round-03-a3, from the name in the legacy tag list alone; no posting or outside source checked",
  "date": "2026-10-29",
  "reviewed_by": null,
  "legacy_tag": {
   "sources": [
    {
     "file": "data/skills_tags.csv",
     "rows": [
      1105
     ],
     "class": "Skill"
    }
   ],
   "class": "Skill",
   "in_lists": []
  }
 },
 "evidence": [
  {
   "field": "definition",
   "by": "model:claude-sonnet-5-5",
   "action": "drafted",
   "date": "2026-10-29",
   "run": "2026-10-29-round-03-a3",
   "note": "basis: general-knowledge"
  },
  {
   "field": "kind",
   "by": "model:claude-sonnet-5-5",
   "action": "drafted",
   "date": "2026-10-29",
   "run": "2026-10-29-round-03-a3",
   "note": "basis: general-knowledge (with the definition)"
  },
  {
   "field": "certification",
   "by": "model:claude-sonnet-5-5",
   "action": "drafted",
   "date": "2026-10-29",
   "run": "2026-10-29-round-03-a3",
   "note": "basis: general-knowledge"
  },
  {
   "field": "variant:cucumberjs",
   "by": "model:claude-sonnet-5-5",
   "action": "drafted",
   "date": "2026-10-29",
   "run": "2026-10-29-round-04-a1",
   "note": "same concept as Cucumber.js, listed in the legacy tag list"
  }
 ]
}
