{
 "id": "aluq16eye4",
 "preferred_name": "CompTIA Green IT Specialist",
 "kind": "credential",
 "definition": "A CompTIA certification covering environmentally responsible use and management of IT equipment.",
 "key": "comptia-green-it-specialist",
 "certification": true,
 "certification_scope": "single-issuer",
 "variants": [],
 "relations": [],
 "verbs": [],
 "status": "machine-drafted",
 "provenance": {
  "source": "drafted by model:claude-sonnet-5-5, run 2026-10-29-round-03-a2, from the name in the legacy tag list alone; no posting or outside source checked",
  "date": "2026-10-29",
  "reviewed_by": null,
  "legacy_tag": {
   "sources": [
    {
     "file": "data/skills_tags.csv",
     "rows": [
      937
     ],
     "class": "Certification"
    },
    {
     "file": "data/skills-certification.csv",
     "rows": [
      421
     ],
     "class": "Certification"
    }
   ],
   "class": "Certification",
   "in_lists": [
    "certification"
   ]
  }
 },
 "evidence": [
  {
   "field": "definition",
   "by": "model:claude-sonnet-5-5",
   "action": "drafted",
   "date": "2026-10-29",
   "run": "2026-10-29-round-03-a2",
   "note": "basis: general-knowledge"
  },
  {
   "field": "kind",
   "by": "model:claude-sonnet-5-5",
   "action": "drafted",
   "date": "2026-10-29",
   "run": "2026-10-29-round-03-a2",
   "note": "basis: general-knowledge (with the definition)"
  },
  {
   "field": "certification",
   "by": "model:claude-sonnet-5-5",
   "action": "drafted",
   "date": "2026-10-29",
   "run": "2026-10-29-round-03-a2",
   "note": "basis: general-knowledge"
  },
  {
   "field": "certification_scope",
   "by": "model:claude-sonnet-5-5",
   "action": "drafted",
   "date": "2026-10-29",
   "run": "2026-10-29-round-03-a2",
   "note": "basis: general-knowledge"
  },
  {
   "field": "definition",
   "by": "model:claude-opus-5-5",
   "action": "checked",
   "outcome": "supports",
   "date": "2026-10-29",
   "run": "2026-10-29-review-3b-opus",
   "note": "Retired; sold as CompTIA Strata Green IT."
  },
  {
   "field": "kind",
   "by": "model:claude-opus-5-5",
   "action": "checked",
   "outcome": "supports",
   "date": "2026-10-29",
   "run": "2026-10-29-review-3b-opus"
  },
  {
   "field": "certification",
   "by": "model:claude-opus-5-5",
   "action": "checked",
   "outcome": "supports",
   "date": "2026-10-29",
   "run": "2026-10-29-review-3b-opus"
  },
  {
   "field": "certification_scope",
   "by": "model:claude-opus-5-5",
   "action": "checked",
   "outcome": "supports",
   "date": "2026-10-29",
   "run": "2026-10-29-review-3b-opus"
  }
 ]
}
