{
 "id": "i8zvokf7v3",
 "preferred_name": "Associate of Applied Science in Criminal Justice",
 "kind": "credential",
 "definition": "An applied associate degree, typically two years of study and awarded by a college, with a major in criminal justice.",
 "key": "associate-of-applied-science-in-criminal-justice",
 "certification": true,
 "certification_scope": "many-issuers",
 "variants": [
  {
   "label": "AAS in Criminal Justice",
   "match": "word_ci"
  }
 ],
 "relations": [],
 "verbs": [],
 "status": "machine-drafted",
 "provenance": {
  "source": "drafted by model:claude-sonnet-5-5, run 2026-10-29-round-08-a3, from the name in the legacy tag list alone; no posting or outside source checked",
  "date": "2026-10-29",
  "reviewed_by": null,
  "legacy_tag": {
   "sources": [
    {
     "file": "data/skills-certification.csv",
     "rows": [
      37
     ],
     "class": "Certification"
    }
   ],
   "class": "Certification",
   "in_lists": [
    "certification"
   ]
  }
 },
 "evidence": [
  {
   "field": "definition",
   "by": "model:claude-sonnet-5-5",
   "action": "drafted",
   "date": "2026-10-29",
   "run": "2026-10-29-round-08-a3",
   "note": "basis: general-knowledge"
  },
  {
   "field": "kind",
   "by": "model:claude-sonnet-5-5",
   "action": "drafted",
   "date": "2026-10-29",
   "run": "2026-10-29-round-08-a3",
   "note": "basis: general-knowledge (with the definition)"
  },
  {
   "field": "variant:aas in criminal justice",
   "by": "model:claude-sonnet-5-5",
   "action": "drafted",
   "date": "2026-10-29",
   "run": "2026-10-29-round-08-a3",
   "note": "basis: general-knowledge"
  },
  {
   "field": "certification",
   "by": "model:claude-sonnet-5-5",
   "action": "drafted",
   "date": "2026-10-29",
   "run": "2026-10-29-round-08-a3",
   "note": "basis: general-knowledge"
  },
  {
   "field": "certification_scope",
   "by": "model:claude-sonnet-5-5",
   "action": "drafted",
   "date": "2026-10-29",
   "run": "2026-10-29-round-08-a3",
   "note": "basis: general-knowledge"
  }
 ]
}
