{
 "id": "iob8vfsklh",
 "preferred_name": "Flagger certification",
 "kind": "credential",
 "definition": "A certificate showing that a person has been trained to direct traffic safely through road work zones as a flagger.",
 "key": "flagger-certification",
 "certification": true,
 "certification_scope": "many-issuers",
 "variants": [
  {
   "label": "Flagger certificate",
   "match": "word_ci"
  }
 ],
 "relations": [],
 "verbs": [],
 "status": "machine-drafted",
 "provenance": {
  "source": "drafted by model:claude-sonnet-5-5, run 2026-10-29-round-04-a4, from the name in the legacy tag list alone; no posting or outside source checked",
  "date": "2026-10-29",
  "reviewed_by": null,
  "legacy_tag": {
   "sources": [
    {
     "file": "data/skills_tags.csv",
     "rows": [
      1625
     ],
     "class": "Certification"
    },
    {
     "file": "data/skills-certification.csv",
     "rows": [
      500
     ],
     "class": "Certification"
    }
   ],
   "class": "Certification",
   "in_lists": [
    "certification"
   ]
  }
 },
 "evidence": [
  {
   "field": "definition",
   "by": "model:claude-sonnet-5-5",
   "action": "drafted",
   "date": "2026-10-29",
   "run": "2026-10-29-round-04-a4",
   "note": "basis: general-knowledge"
  },
  {
   "field": "kind",
   "by": "model:claude-sonnet-5-5",
   "action": "drafted",
   "date": "2026-10-29",
   "run": "2026-10-29-round-04-a4",
   "note": "basis: general-knowledge (with the definition)"
  },
  {
   "field": "variant:flagger certificate",
   "by": "model:claude-sonnet-5-5",
   "action": "drafted",
   "date": "2026-10-29",
   "run": "2026-10-29-round-04-a4",
   "note": "basis: general-knowledge"
  },
  {
   "field": "certification",
   "by": "model:claude-sonnet-5-5",
   "action": "drafted",
   "date": "2026-10-29",
   "run": "2026-10-29-round-04-a4",
   "note": "basis: general-knowledge"
  },
  {
   "field": "certification_scope",
   "by": "model:claude-sonnet-5-5",
   "action": "drafted",
   "date": "2026-10-29",
   "run": "2026-10-29-round-04-a4",
   "note": "basis: general-knowledge"
  },
  {
   "field": "definition",
   "by": "model:claude-opus-5-5",
   "action": "checked",
   "outcome": "supports",
   "date": "2026-10-29",
   "run": "2026-10-29-review-3b-opus"
  },
  {
   "field": "kind",
   "by": "model:claude-opus-5-5",
   "action": "checked",
   "outcome": "supports",
   "date": "2026-10-29",
   "run": "2026-10-29-review-3b-opus"
  },
  {
   "field": "certification",
   "by": "model:claude-opus-5-5",
   "action": "checked",
   "outcome": "supports",
   "date": "2026-10-29",
   "run": "2026-10-29-review-3b-opus"
  },
  {
   "field": "certification_scope",
   "by": "model:claude-opus-5-5",
   "action": "checked",
   "outcome": "supports",
   "date": "2026-10-29",
   "run": "2026-10-29-review-3b-opus"
  },
  {
   "field": "variant:flagger certificate",
   "by": "model:claude-opus-5-5",
   "action": "checked",
   "outcome": "supports",
   "date": "2026-10-29",
   "run": "2026-10-29-review-3b-opus"
  },
  {
   "field": "definition",
   "by": "model:gpt-6",
   "action": "checked",
   "outcome": "supports",
   "date": "2026-10-29",
   "run": "external-2026-10-29-gpt-6-unknown"
  },
  {
   "field": "kind",
   "by": "model:gpt-6",
   "action": "checked",
   "outcome": "supports",
   "date": "2026-10-29",
   "run": "external-2026-10-29-gpt-6-unknown"
  },
  {
   "field": "certification",
   "by": "model:gpt-6",
   "action": "checked",
   "outcome": "supports",
   "date": "2026-10-29",
   "run": "external-2026-10-29-gpt-6-unknown"
  },
  {
   "field": "certification_scope",
   "by": "model:gpt-6",
   "action": "checked",
   "outcome": "supports",
   "date": "2026-10-29",
   "run": "external-2026-10-29-gpt-6-unknown"
  },
  {
   "field": "variant:flagger certificate",
   "by": "model:gpt-6",
   "action": "checked",
   "outcome": "supports",
   "date": "2026-10-29",
   "run": "external-2026-10-29-gpt-6-unknown"
  }
 ]
}
