{
 "id": "ymw59zes79",
 "preferred_name": "Computer-assisted qualitative data analysis software (CAQDAS)",
 "kind": "tool",
 "definition": "Software for organising, coding and analysing non-numerical data such as interviews, text and recordings.",
 "key": "computer-assisted-qualitative-data-analysis-software-caqdas",
 "certification": false,
 "variants": [
  {
   "label": "Computer-Assisted Qualitative Data Analysis Software",
   "match": "word_ci"
  },
  {
   "label": "CAQDAS",
   "match": "word_ci"
  }
 ],
 "relations": [],
 "verbs": [],
 "status": "machine-drafted",
 "provenance": {
  "source": "drafted by model:claude-sonnet-5-5, run 2026-10-29-round-03-a2, from the name in the legacy tag list alone; no posting or outside source checked",
  "date": "2026-10-29",
  "reviewed_by": null,
  "legacy_tag": {
   "sources": [
    {
     "file": "data/skills_tags.csv",
     "rows": [
      991
     ],
     "class": "Skill"
    }
   ],
   "class": "Skill",
   "in_lists": []
  }
 },
 "evidence": [
  {
   "field": "definition",
   "by": "model:claude-sonnet-5-5",
   "action": "drafted",
   "date": "2026-10-29",
   "run": "2026-10-29-round-03-a2",
   "note": "basis: general-knowledge"
  },
  {
   "field": "kind",
   "by": "model:claude-sonnet-5-5",
   "action": "drafted",
   "date": "2026-10-29",
   "run": "2026-10-29-round-03-a2",
   "note": "basis: general-knowledge (with the definition)"
  },
  {
   "field": "variant:computer-assisted qualitative data analysis software",
   "by": "model:claude-sonnet-5-5",
   "action": "drafted",
   "date": "2026-10-29",
   "run": "2026-10-29-round-03-a2",
   "note": "listed in the legacy tag list; the model chose the canonical name"
  },
  {
   "field": "variant:caqdas",
   "by": "model:claude-sonnet-5-5",
   "action": "drafted",
   "date": "2026-10-29",
   "run": "2026-10-29-round-03-a2",
   "note": "basis: general-knowledge"
  },
  {
   "field": "certification",
   "by": "model:claude-sonnet-5-5",
   "action": "drafted",
   "date": "2026-10-29",
   "run": "2026-10-29-round-03-a2",
   "note": "basis: general-knowledge"
  }
 ]
}
