{
 "id": "p1dlftn9sg",
 "preferred_name": "Instagram",
 "kind": "platform",
 "definition": "A social media platform, owned by Meta, for sharing photos and short videos.",
 "key": "instagram",
 "certification": false,
 "variants": [],
 "relations": [],
 "verbs": [],
 "status": "machine-drafted",
 "provenance": {
  "source": "drafted by model:claude-sonnet-5-5, run 2026-10-29-round-06-a1, from the name in the legacy tag list alone; no posting or outside source checked",
  "date": "2026-10-29",
  "reviewed_by": null,
  "legacy_tag": {
   "sources": [
    {
     "file": "data/skills_tags.csv",
     "rows": [
      2103
     ],
     "class": "Skill"
    }
   ],
   "class": "Skill",
   "in_lists": []
  }
 },
 "evidence": [
  {
   "field": "definition",
   "by": "model:claude-sonnet-5-5",
   "action": "drafted",
   "date": "2026-10-29",
   "run": "2026-10-29-round-06-a1",
   "note": "basis: general-knowledge"
  },
  {
   "field": "kind",
   "by": "model:claude-sonnet-5-5",
   "action": "drafted",
   "date": "2026-10-29",
   "run": "2026-10-29-round-06-a1",
   "note": "basis: general-knowledge (with the definition)"
  },
  {
   "field": "certification",
   "by": "model:claude-sonnet-5-5",
   "action": "drafted",
   "date": "2026-10-29",
   "run": "2026-10-29-round-06-a1",
   "note": "basis: general-knowledge"
  },
  {
   "field": "definition",
   "by": "model:claude-opus-5-5",
   "action": "checked",
   "outcome": "supports",
   "date": "2026-10-29",
   "run": "2026-10-29-review-5h-opus"
  },
  {
   "field": "kind",
   "by": "model:claude-opus-5-5",
   "action": "checked",
   "outcome": "supports",
   "date": "2026-10-29",
   "run": "2026-10-29-review-5h-opus"
  },
  {
   "field": "certification",
   "by": "model:claude-opus-5-5",
   "action": "checked",
   "outcome": "supports",
   "date": "2026-10-29",
   "run": "2026-10-29-review-5h-opus"
  }
 ]
}
