{
 "id": "xiupcoba2m",
 "preferred_name": "HTML emails",
 "kind": "skill",
 "definition": "Designing and coding email messages in HTML, allowing for the uneven way email clients display them.",
 "key": "html-emails",
 "certification": false,
 "variants": [
  {
   "label": "HTML email",
   "match": "word_ci"
  }
 ],
 "relations": [],
 "verbs": [],
 "status": "machine-drafted",
 "provenance": {
  "source": "drafted by model:claude-sonnet-5-5, run 2026-10-29-round-05-a3, from the name in the legacy tag list alone; no posting or outside source checked",
  "date": "2026-10-29",
  "reviewed_by": null,
  "legacy_tag": {
   "sources": [
    {
     "file": "data/skills_tags.csv",
     "rows": [
      1851
     ],
     "class": "Skill"
    }
   ],
   "class": "Skill",
   "in_lists": []
  }
 },
 "evidence": [
  {
   "field": "definition",
   "by": "model:claude-sonnet-5-5",
   "action": "drafted",
   "date": "2026-10-29",
   "run": "2026-10-29-round-05-a3",
   "note": "basis: general-knowledge"
  },
  {
   "field": "kind",
   "by": "model:claude-sonnet-5-5",
   "action": "drafted",
   "date": "2026-10-29",
   "run": "2026-10-29-round-05-a3",
   "note": "basis: general-knowledge (with the definition)"
  },
  {
   "field": "variant:html email",
   "by": "model:claude-sonnet-5-5",
   "action": "drafted",
   "date": "2026-10-29",
   "run": "2026-10-29-round-05-a3",
   "note": "basis: general-knowledge"
  },
  {
   "field": "certification",
   "by": "model:claude-sonnet-5-5",
   "action": "drafted",
   "date": "2026-10-29",
   "run": "2026-10-29-round-05-a3",
   "note": "basis: general-knowledge"
  },
  {
   "field": "definition",
   "by": "model:claude-opus-5-5",
   "action": "checked",
   "outcome": "supports",
   "date": "2026-10-29",
   "run": "2026-10-29-review-5g-opus"
  },
  {
   "field": "kind",
   "by": "model:claude-opus-5-5",
   "action": "checked",
   "outcome": "supports",
   "date": "2026-10-29",
   "run": "2026-10-29-review-5g-opus"
  },
  {
   "field": "certification",
   "by": "model:claude-opus-5-5",
   "action": "checked",
   "outcome": "supports",
   "date": "2026-10-29",
   "run": "2026-10-29-review-5g-opus"
  },
  {
   "field": "variant:html email",
   "by": "model:claude-opus-5-5",
   "action": "checked",
   "outcome": "supports",
   "date": "2026-10-29",
   "run": "2026-10-29-review-5g-opus"
  },
  {
   "field": "definition",
   "by": "model:gpt-6",
   "action": "checked",
   "outcome": "supports",
   "date": "2026-10-29",
   "run": "external-2026-10-29-gpt-6-unknown"
  },
  {
   "field": "kind",
   "by": "model:gpt-6",
   "action": "checked",
   "outcome": "supports",
   "date": "2026-10-29",
   "run": "external-2026-10-29-gpt-6-unknown"
  },
  {
   "field": "certification",
   "by": "model:gpt-6",
   "action": "checked",
   "outcome": "supports",
   "date": "2026-10-29",
   "run": "external-2026-10-29-gpt-6-unknown"
  },
  {
   "field": "variant:html email",
   "by": "model:gpt-6",
   "action": "checked",
   "outcome": "supports",
   "date": "2026-10-29",
   "run": "external-2026-10-29-gpt-6-unknown"
  }
 ]
}
