{
 "id": "rc7lhj91wt",
 "preferred_name": "Certified Asthma Educator",
 "kind": "credential",
 "definition": "A certification showing that a health professional can teach people with asthma and their families how to manage the condition.",
 "key": "certified-asthma-educator",
 "certification": true,
 "certification_scope": "single-issuer",
 "variants": [
  {
   "label": "AE-C",
   "match": "exact_case"
  }
 ],
 "relations": [
  {
   "type": "related",
   "target": "mhz7f3lsy1"
  }
 ],
 "verbs": [],
 "status": "machine-drafted",
 "provenance": {
  "source": "drafted by model:claude-sonnet-5-5, run 2026-10-29-round-02-a3, from the name in the legacy tag list alone; no posting or outside source checked",
  "date": "2026-10-29",
  "reviewed_by": null,
  "legacy_tag": {
   "sources": [
    {
     "file": "data/skills_tags.csv",
     "rows": [
      663
     ],
     "class": "Certification"
    },
    {
     "file": "data/skills-certification.csv",
     "rows": [
      272
     ],
     "class": "Certification"
    }
   ],
   "class": "Certification",
   "in_lists": [
    "certification"
   ]
  }
 },
 "evidence": [
  {
   "field": "definition",
   "by": "model:claude-sonnet-5-5",
   "action": "drafted",
   "date": "2026-10-29",
   "run": "2026-10-29-round-02-a3",
   "note": "basis: general-knowledge"
  },
  {
   "field": "kind",
   "by": "model:claude-sonnet-5-5",
   "action": "drafted",
   "date": "2026-10-29",
   "run": "2026-10-29-round-02-a3",
   "note": "basis: general-knowledge (with the definition)"
  },
  {
   "field": "variant:ae-c",
   "by": "model:claude-sonnet-5-5",
   "action": "drafted",
   "date": "2026-10-29",
   "run": "2026-10-29-round-02-a3",
   "note": "basis: general-knowledge"
  },
  {
   "field": "relation:related:mhz7f3lsy1",
   "by": "model:claude-sonnet-5-5",
   "action": "drafted",
   "date": "2026-10-29",
   "run": "2026-10-29-round-02-a3",
   "note": "basis: general-knowledge"
  },
  {
   "field": "certification",
   "by": "model:claude-sonnet-5-5",
   "action": "drafted",
   "date": "2026-10-29",
   "run": "2026-10-29-round-02-a3",
   "note": "basis: general-knowledge"
  },
  {
   "field": "certification_scope",
   "by": "model:claude-sonnet-5-5",
   "action": "drafted",
   "date": "2026-10-29",
   "run": "2026-10-29-round-02-a3",
   "note": "basis: general-knowledge"
  },
  {
   "field": "definition",
   "by": "model:claude-opus-5-5",
   "action": "checked",
   "outcome": "supports",
   "date": "2026-10-29",
   "run": "2026-10-29-review-3a-opus",
   "note": "Issuer is the National Asthma Educator Certification Board"
  },
  {
   "field": "kind",
   "by": "model:claude-opus-5-5",
   "action": "checked",
   "outcome": "supports",
   "date": "2026-10-29",
   "run": "2026-10-29-review-3a-opus"
  },
  {
   "field": "certification",
   "by": "model:claude-opus-5-5",
   "action": "checked",
   "outcome": "supports",
   "date": "2026-10-29",
   "run": "2026-10-29-review-3a-opus"
  },
  {
   "field": "certification_scope",
   "by": "model:claude-opus-5-5",
   "action": "checked",
   "outcome": "supports",
   "date": "2026-10-29",
   "run": "2026-10-29-review-3a-opus"
  },
  {
   "field": "variant:ae-c",
   "by": "model:claude-opus-5-5",
   "action": "checked",
   "outcome": "supports",
   "date": "2026-10-29",
   "run": "2026-10-29-review-3a-opus"
  },
  {
   "field": "relation:related:mhz7f3lsy1",
   "by": "model:claude-opus-5-5",
   "action": "checked",
   "outcome": "supports",
   "date": "2026-10-29",
   "run": "2026-10-29-review-3a-opus"
  }
 ]
}
