{
 "id": "prkfpz7o8w",
 "former_ids": [
  "skill:00111"
 ],
 "preferred_name": "Esker",
 "kind": "tool",
 "definition": "Cloud software for automating document-based business processes such as accounts payable and order processing.",
 "key": "esker",
 "certification": false,
 "variants": [
  {
   "label": "Esker (Software)",
   "match": "word_ci"
  }
 ],
 "relations": [],
 "verbs": [],
 "status": "machine-drafted",
 "provenance": {
  "source": "drafted by model:claude-sonnet-5-5, run 2026-10-29-pilot-100-tags, from the name in the legacy tag list alone; no posting or outside source checked",
  "date": "2026-10-29",
  "reviewed_by": null,
  "legacy_tag": {
   "sources": [
    {
     "file": "data/skills_tags.csv",
     "rows": [
      1505
     ],
     "class": "Skill"
    }
   ],
   "class": "Skill",
   "in_lists": []
  }
 },
 "evidence": [
  {
   "field": "definition",
   "by": "model:claude-sonnet-5-5",
   "action": "drafted",
   "date": "2026-10-29",
   "run": "2026-10-29-pilot-100-tags",
   "note": "basis: general-knowledge"
  },
  {
   "field": "kind",
   "by": "model:claude-sonnet-5-5",
   "action": "drafted",
   "date": "2026-10-29",
   "run": "2026-10-29-pilot-100-tags",
   "note": "basis: general-knowledge (with the definition)"
  },
  {
   "field": "variant:esker (software)",
   "by": "model:claude-sonnet-5-5",
   "action": "drafted",
   "date": "2026-10-29",
   "run": "2026-10-29-pilot-100-tags",
   "note": "listed in the legacy tag list; the model chose the canonical name"
  },
  {
   "field": "certification",
   "by": "model:claude-sonnet-5-5",
   "action": "drafted",
   "date": "2026-10-29",
   "run": "2026-10-29-pilot-100-tags",
   "note": "basis: general-knowledge"
  },
  {
   "field": "kind",
   "by": "model:claude-sonnet-5-5",
   "action": "checked",
   "outcome": "contradicts",
   "date": "2026-10-29",
   "run": "2026-10-29-pilot-100-tags-blind-redraft",
   "note": "second draft (xhigh) said platform"
  },
  {
   "field": "certification",
   "by": "model:claude-sonnet-5-5",
   "action": "checked",
   "outcome": "supports",
   "date": "2026-10-29",
   "run": "2026-10-29-pilot-100-tags-blind-redraft",
   "note": "second draft (xhigh) gave the same value"
  }
 ]
}
