{
 "id": "ngph5j5f3b",
 "preferred_name": "Stress testing (computing)",
 "kind": "method",
 "definition": "Running a software system under loads or conditions beyond normal use to see where and how it fails.",
 "key": "stress-testing-computing",
 "certification": false,
 "variants": [
  {
   "label": "Stree Testing (Computing)",
   "match": "word_ci"
  }
 ],
 "relations": [
  {
   "type": "broader",
   "target": "ss273uzint"
  }
 ],
 "verbs": [],
 "status": "machine-drafted",
 "provenance": {
  "source": "drafted by model:claude-sonnet-5-5, run 2026-10-29-round-08-a1, from the name in the legacy tag list alone; no posting or outside source checked",
  "date": "2026-10-29",
  "reviewed_by": null,
  "legacy_tag": {
   "sources": [
    {
     "file": "data/skills_tags.csv",
     "rows": [
      3754
     ],
     "class": "Skill"
    }
   ],
   "class": "Skill",
   "in_lists": []
  }
 },
 "evidence": [
  {
   "field": "definition",
   "by": "model:claude-sonnet-5-5",
   "action": "drafted",
   "date": "2026-10-29",
   "run": "2026-10-29-round-08-a1",
   "note": "basis: general-knowledge"
  },
  {
   "field": "kind",
   "by": "model:claude-sonnet-5-5",
   "action": "drafted",
   "date": "2026-10-29",
   "run": "2026-10-29-round-08-a1",
   "note": "basis: general-knowledge (with the definition)"
  },
  {
   "field": "variant:stree testing (computing)",
   "by": "model:claude-sonnet-5-5",
   "action": "drafted",
   "date": "2026-10-29",
   "run": "2026-10-29-round-08-a1",
   "note": "listed in the legacy tag list; the model chose the canonical name"
  },
  {
   "field": "relation:broader:ss273uzint",
   "by": "model:claude-sonnet-5-5",
   "action": "drafted",
   "date": "2026-10-29",
   "run": "2026-10-29-round-08-a1",
   "note": "basis: general-knowledge"
  },
  {
   "field": "certification",
   "by": "model:claude-sonnet-5-5",
   "action": "drafted",
   "date": "2026-10-29",
   "run": "2026-10-29-round-08-a1",
   "note": "basis: general-knowledge"
  },
  {
   "field": "definition",
   "by": "model:claude-opus-5-5",
   "action": "checked",
   "outcome": "supports",
   "date": "2026-10-29",
   "run": "2026-10-29-review-5p-opus"
  },
  {
   "field": "kind",
   "by": "model:claude-opus-5-5",
   "action": "checked",
   "outcome": "supports",
   "date": "2026-10-29",
   "run": "2026-10-29-review-5p-opus"
  },
  {
   "field": "certification",
   "by": "model:claude-opus-5-5",
   "action": "checked",
   "outcome": "supports",
   "date": "2026-10-29",
   "run": "2026-10-29-review-5p-opus"
  },
  {
   "field": "variant:stree testing (computing)",
   "by": "model:claude-opus-5-5",
   "action": "checked",
   "outcome": "contradicts",
   "date": "2026-10-29",
   "run": "2026-10-29-review-5p-opus",
   "note": "misspelling of 'Stress'"
  },
  {
   "field": "relation:broader:ss273uzint",
   "by": "model:claude-opus-5-5",
   "action": "checked",
   "outcome": "supports",
   "date": "2026-10-29",
   "run": "2026-10-29-review-5p-opus"
  }
 ]
}
